<?xml version="1.0" encoding="ISO-8859-1"?>
<!DOCTYPE file-format SYSTEM
        "/Users/jarsen/IdeaProjects/PRP-MQ/src/main/resources/configuration/flatworm-data-description_1_0.dtd">
<file-format>
    <converter name="char" class="com.blackbear.flatworm.converters.CoreConverters" method="convertChar"
               return-type="java.lang.String"/>
    <converter name="decimal" class="com.blackbear.flatworm.converters.CoreConverters" method="convertDecimal"
               return-type="java.lang.Double"/>
    <converter name="integer" class="com.blackbear.flatworm.converters.CoreConverters" method="convertInteger"
               return-type="java.lang.Integer"/>
    <converter name="date" class="com.blackbear.flatworm.converters.CoreConverters" method="convertDate"
               return-type="java.sql.Date"/>

    <record name="application">
        <record-ident>
            <field-ident field-start="0" field-length="4">
                <match-string>APP2</match-string>
            </field-ident>
        </record-ident>
        <record-definition>
            <bean name="application" class="gov.hhs.cms.prp.entity.PrpApplicationEntity"/>
            <line>
                <record-element length="4"/> <!-- Segment ID -->
                <record-element length="10" beanref="application.applPsId" type="integer"/>
                <record-element length="10" beanref="application.applId" type="integer"/>
                <record-element length="8" beanref="application.applStartDate" type="date">
                    <conversion-option name="format" value="yyyyMMdd"/>
                </record-element>
                <record-element length="8" beanref="application.applEndDate" type="date">
                    <conversion-option name="format" value="yyyyMMdd"/>
                </record-element>
                <record-element length="2" beanref="application.applStatus" type="char"/>
                <record-element length="1" beanref="application.applTransMethod" type="char"/>
                <record-element length="1" beanref="application.applExtension" type="char"/>
                <record-element length="1" beanref="application.applRetlistSw" type="char"/>
                <record-element length="30" beanref="application.applPsCompany" type="char">
                    <conversion-option name="pad-character" value=" "/>
                    <conversion-option name="justify" value="left"/>
                </record-element>
                <record-element length="8" beanref="application.applRcncltnDate" type="date">
                    <conversion-option name="format" value="yyyyMMdd"/>
                </record-element>
                <record-element length="1"/> <!-- Reconciliation date update indicator -->
                <record-element length="8" beanref="application.applStp4Dt" type="date">
                    <conversion-option name="format" value="yyyyMMdd"/>
                </record-element>
                <record-element length="1"/> <!-- Step 4 date update indicator -->
                <record-element length="27"/> <!-- Filler -->
            </line>
        </record-definition>
    </record>
    <record name="planOption">
        <record-ident>
            <field-ident field-start="0" field-length="4">
                <match-string>OPT2</match-string>
            </field-ident>
        </record-ident>
        <record-definition>
            <bean name="planOption" class="gov.hhs.cms.prp.entity.PrpPlanOptionsEntity"/>
            <line>
                <record-element length="4"/> <!-- Segment ID -->
                <record-element length="10" beanref="planOption.planNdmVendor" type="char">
                    <conversion-option name="pad-character" value="0"/>
                    <conversion-option name="justify" value="right"/>
                </record-element>
                <record-element length="10" beanref="planOption.planApplId" type="integer"/>
                <record-element length="20" beanref="planOption.planGroupNumber" type="char">
                    <conversion-option name="pad-character" value=" "/>
                    <conversion-option name="justify" value="left"/>
                </record-element>
                <record-element length="1" beanref="planOption.planSubmMethod" type="char"/>
                <record-element length="1" beanref="planOption.planRespMethod" type="char"/>
                <record-element length="1" beanref="planOption.planNotifMethod" type="char"/>
                <record-element length="4" beanref="planOption.planVdsaPlanNum" type="char" />
                <record-element length="9" beanref="planOption.planVdsaMirId" type="char">
                    <conversion-option name="pad-character" value="0"/>
                    <conversion-option name="justify" value="right"/>
                </record-element>
                <record-element length="10"/> <!-- Filler -->
            </line>
        </record-definition>
    </record>

</file-format>