<?xml version="1.0" encoding="ISO-8859-1"?>
<!DOCTYPE file-format SYSTEM "/Users/jarsen/IdeaProjects/PRP/prp-mq/src/main/resources/configuration/flatworm-data-description_1_0.dtd">
<file-format>
    <converter name="char" class="com.blackbear.flatworm.converters.CoreConverters" method="convertChar" return-type="java.lang.String" />
    <converter name="decimal" class="com.blackbear.flatworm.converters.CoreConverters" method="convertDecimal" return-type="java.lang.Double" />
    <record name="newhire">
        <record-ident>
            <field-ident field-start="0" field-length="2">
                <match-string>NH</match-string>
            </field-ident>
        </record-ident>
        <record-definition>
            <bean name="employee" class="gov.hhs.cms.prp.messaging.entitytmp.Employee" />
            <line>
                <record-element length="2" />
                <record-element length="15" beanref="employee.firstName" type="char">
                    <conversion-option name="justify" value="left" />
                </record-element>
                <record-element length="15" beanref="employee.lastName" type="char">
                    <conversion-option name="justify" value="left" />
                </record-element>
                <record-element length="1" beanref="employee.gender" type="char" />
                <record-element length="11" beanref="employee.ssn" type="char">
                    <conversion-option name="strip-chars" value="non-numeric" />
                </record-element>
                <record-element length="10" beanref="employee.salary" type="decimal">
                    <conversion-option name="decimal-places" value="2" />
                    <conversion-option name="decimal-implied" value="true" />
                    <conversion-option name="pad-character" value="0" />
                    <conversion-option name="justify" value="right" />
                </record-element>

            </line>
        </record-definition>
    </record>
</file-format>